id,lang,shape,content
exaggeration,en,s,"Exaggerator (foaled February 5, 2013) is a retired American Thoroughbred racehorse, winner of the 2016 Preakness Stakes.  Racing as a two-year-old in 2015, he won three of his six starts including the Saratoga Special Stakes and the Delta Jackpot Stakes as well as finishing second in the Breeders' Futurity and fourth in the Breeders' Cup Juvenile."
liquid fuel,en,s,"Liquid fuels are combustible or energy-generating molecules that can be harnessed to create mechanical energy, usually producing kinetic energy; they also must take the shape of their container.  It is the fumes of liquid fuels that are flammable instead of the fluid. Most liquid fuels in widespread use are derived from fossil fuels; however, there are several types, such as hydrogen fuel (for automotive uses), ethanol, and biodiesel, which are also categorized as a liquid fuel."
Subcompact car,en,s,"Subcompact car is a North American classification for cars smaller than a compact car.  It is broadly equivalent to the B-segment (Europe), supermini (Great Britain) or A0-class (China) classifications. According to the U. S.  Environmental Protection Agency (EPA) car size class definition, the subcompact category sits between the ""minicompact"" and ""compact"" categories."
Nissan Sentra,en,s,"The Nissan Sentra is a series of automobiles manufactured by the Japanese automaker Nissan since 1982.  Since 1999, the Sentra has been categorized as a compact car, while previously it occupied the subcompact class.  Until 2006, Sentra was a rebadged export version of the Japanese Nissan Sunny, but since the 2013 model year, Sentra is a rebadged export version of the Sylphy.  The Sentra nameplate is not used in Japan."
English in the Commonwealth of Nations,en,s,"The use of the English language in current and former Commonwealth countries was largely inherited from British colonisation, with some exceptions.  English serves as the medium of inter-Commonwealth relations and the language forms part of the common culture of the Commonwealth."
diesel engine,en,s,"The diesel engine, named after the German engineer Rudolf Diesel, is an internal combustion engine in which ignition of the fuel is caused by the elevated temperature of the air in the cylinder due to mechanical compression; thus, the diesel engine is called a compression-ignition engine (CI engine)."
Diesel fuel,en,s,"Diesel fuel, also called diesel oil, heavy oil (historically) or simply diesel, is any liquid fuel specifically designed for use in a diesel engine, a type of internal combustion engine in which fuel ignition takes place without a spark as a result of compression of the inlet air and then injection of fuel.  Therefore, diesel fuel needs good compression ignition characteristics."
gross vehicle weight,en,s,Vehicle weight is a measurement of wheeled motor vehicles; either an actual measured weight of the vehicle under defined conditions or a gross weight rating for its weight carrying capacity.
Public company,en,s,"A public company is a company whose ownership is organized via shares of stock which are intended to be freely traded on a stock exchange or in over-the-counter markets.  A public (publicly traded) company can be listed on a stock exchange (listed company), which facilitates the trade of shares, or not (unlisted public company).  In some jurisdictions, public companies over a certain size must be listed on an exchange."
Petrol,en,s,"Gasoline (North American English) or petrol (Commonwealth English) is a petrochemical product characterized as a transparent, yellowish, and flammable liquid normally used as a fuel for spark-ignited internal combustion engines.  When formulated as a fuel for engines, gasoline is chemically composed of organic compounds derived from the fractional distillation of petroleum and later chemically enhanced with gasoline additives."
Holden,en,s,"Hold on is the sixth and final album by the British hard rock band Trapeze.   The album was originally released in Germany in 1978 under the name Running with a different track order and album cover.  This was the first and only studio Trapeze album to feature vocalist Pete Goalby, who later worked with Uriah Heep.  Track listing All songs written by Mel Galley, except where noted."
Aichi Kikai,en,s,"Aichi Kokuki KK (愛知航空機株式会社, Aichi Kōkūki Kabushiki Kaisha, Aichi Aircraft Co. , Ltd. ) was a Japanese aerospace manufacturer which produced several designs for the Imperial Japanese Navy.  After the war, the company was reorganized as Aichi Machine Industry Co. , Ltd (愛知機械工業) where they made small kei cars until 1966 when they were integrated into Nissan and developed the Nissan Sunny and Nissan Vanette."
Akio Toyoda,en,s,
Nikkei 225,en,s,"The Nikkei 225, or the Nikkei Stock Average (Japanese: 日経平均株価, Hepburn: Nikkei heikin kabuka), more commonly called the Nikkei or the Nikkei index (), is a stock market index for the Tokyo Stock Exchange (TSE).   It is a price-weighted index, operating in the Japanese Yen (JP¥), and its components are reviewed twice a year.  The Nikkei 225 measures the performance of 225 highly capitalised and liquid publicly owned companies in Japan from a wide array of industry sectors."
Human-powered transport,en,s,"Human-powered transport is the transport of person(s) and/or goods (freight) using human muscle power.  Unlike animal-powered transport, human-powered transport has existed since time immemorial in the form of walking, running and swimming, as well as small vehicles such as litters, rickshaws, wheelchairs and wheelbarrows.  Modern technology has allowed mechanical advantage devices and machines to enhance human-power."
Daihatsu,en,s,"Daihatsu Motor Co. , Ltd.  (Japanese: ダイハツ工業株式会社, Hepburn: Daihatsu Kōgyō Kabushiki-gaisha) is a Japanese automobile manufacturer headquartered in Ikeda, Osaka Prefecture, Japan. Historically one of the oldest surviving Japanese internal combustion engine manufacturers, the company was known for building three-wheeled vehicles and off-road vehicles, while currently the company offers a range of kei car models, along with kei trucks, kei vans and other larger small cars in Japan."
TOPIX,en,s,"Nikola Topić (Serbian Cyrillic: Никола Топић, born 10 August 2005) is a Serbian professional basketball player for the Oklahoma City Thunder of the National Basketball Association (NBA).  Standing at 6 ft 6 in (1. 98 m), he plays at the point guard position.  Early career Topić grew up playing basketball for KK Defense from his native Novi Sad from which he joined the Crvena zvezda youth system in June 2020."
goods vehicle,en,s,"A large goods vehicle (LGV), or heavy goods vehicle (HGV), in the European Union (EU) is any lorry with a gross combination mass (GCM) of over 3,500 kg (7,700 lb).  Sub-category N2 is used for vehicles between 3,500 kg and 12,000 kg (26,000 lb) and N3 for all goods vehicles over 12,000 kg as defined in Directive 2001/116/EC."
Californio,en,s,"Californios (singular Californio) are Hispanic Californians, especially those descended from Spanish and Mexican settlers of the 17th through 19th centuries before California was annexed by the United States.  California's Spanish-speaking community has resided there since 1683 and is made up of varying Spanish and Mexican origins, including criollos, Mestizos, Indigenous Californian peoples, and small numbers of Mulatos."
Bicycle wheel,en,s,"A bicycle wheel is a wheel, most commonly a wire wheel, designed for a bicycle.  A pair is often called a wheelset, especially in the context of ready built ""off the shelf"" performance-oriented wheels. Bicycle wheels are typically designed to fit into the frame and fork via dropouts, and hold bicycle tires.  Invention The first wheel to use the tension in metal spokes was invented by Sir George Cayley to achieve lightness in his 1853 glider."
Benz Patent-Motorwagen,en,s,"The Benz Patent-Motorwagen (""patent motorcar""), built in 1885 by the German Karl Benz, is widely regarded as the first practical modern automobile and was the first car put into production.  It was patented in January 1886 and unveiled in public later that year.  The original cost of the vehicle was 600 imperial German marks, approximately 150 US dollars (equivalent to $5,100 in 2023)."
mechanical energy,en,s,"In  physical sciences, mechanical energy is the sum of potential energy and kinetic energy.  The principle of conservation of mechanical energy states that if an isolated system is subject only to conservative forces, then the mechanical energy is constant.  If an object moves in the opposite direction of a conservative net force, the potential energy will increase; and if the speed (not the velocity) of the object changes, the kinetic energy of the object also changes."
Toyota Probox,en,s,
Daihatsu Applause,en,s,"The Daihatsu Applause (Japanese: ダイハツ・アプローズ, Daihatsu Apurōzu) is a compact car (C-segment in Europe) manufactured by the Japanese automaker Daihatsu for British and Australian markets.  The Daihatsu Applause was manufactured from 1989 to 2000.  It is most notable for its unusual body style, which, despite appearing to be a 4-door notchback sedan, is in fact a 5-door liftback with a notchback-shaped 412-litre trunk and a tailgate."
Benz Patent Motorwagen,en,s,"The Benz Patent-Motorwagen (""patent motorcar""), built in 1885 by the German Karl Benz, is widely regarded as the first practical modern automobile and was the first car put into production.  It was patented in January 1886 and unveiled in public later that year.  The original cost of the vehicle was 600 imperial German marks, approximately 150 US dollars (equivalent to $5,100 in 2023)."
automobile,en,s,"A car, or an automobile, is a motor vehicle with wheels.  Most definitions of cars state that they run primarily on roads, seat one to eight people, have four wheels, and mainly transport people over cargo.  There are around one billion cars in use worldwide.  The car is considered an important part of the developed economy."
Car,en,s,"The cat (Felis catus), also referred to as domestic cat or house cat, is a small domesticated carnivorous mammal.  It is the only domesticated species of the family Felidae.  Advances in archaeology and genetics have shown that the domestication of the cat occurred in the Near East around 7500 BC.  It is commonly kept as a pet and farm cat, but also ranges freely as a feral cat avoiding human contact."
electric bicycle,en,s,"An electric bicycle, e-bike, electrically assisted pedal cycle, or electrically power assisted cycle is a motorized bicycle with an integrated electric motor used to assist propulsion.  Many kinds of e-bikes are available worldwide, but they generally fall into two broad categories: bikes that assist the rider's pedal-power (i. e.  pedelecs) and bikes that add a throttle, integrating moped-style functionality."
Kiichiro Toyoda,en,s,"Kiichiro Toyoda (Japanese: 豊田 喜一郎（とよだ きいちろう）, Hepburn: Toyoda Kiichirō, June 11, 1894 – March 27, 1952) was a Japanese businessman and the son of Toyoda Loom Works founder Sakichi Toyoda.  His decision to change Toyoda's focus from automatic loom manufacture into automobile manufacturing created what later became Toyota Motor Corporation."
Cargo,en,s,
electric motor,en,s,"An electric motor is a machine that converts electrical energy into mechanical energy.  Most electric motors operate through the interaction between the motor's magnetic field and electric current in a wire winding to generate force in the form of torque applied on the motor's shaft.  An electric generator is mechanically identical to an electric motor, but operates in reverse, converting mechanical energy into electrical energy."
aircraft,en,s,"An aircraft (pl. : aircraft) is a vehicle that is able to fly by gaining support from the air.  It counters the force of gravity by using either static lift or the dynamic lift of an airfoil, or, in a few cases, direct downward thrust from its engines.  Common examples of aircraft include airplanes, helicopters, airships (including blimps), gliders, paramotors, and hot air balloons. The human activity that surrounds aircraft is called aviation."
Lubricant,en,s,"Lubrication is the process or technique of using a lubricant to reduce friction and wear and tear in a contact between two surfaces.  The study of lubrication is a discipline in the field of tribology. Lubrication mechanisms such as fluid-lubricated systems are designed so that the applied load is partially or completely carried by hydrodynamic or hydrostatic pressure, which reduces solid body interactions (and consequently friction and wear)."
fossil fuels,en,s,"A fossil fuel is a carbon compound- or hydrocarbon-containing material formed naturally in the Earth's crust from the buried remains of prehistoric organisms (animals, plants or planktons), a process that occurs within geological formations."
Toyota Corolla (E120),en,s,
