id,lang,shape,content
Nissan Almera,en,s,"The Nissan Almera is a line of automobiles that has been manufactured by the Japanese car manufacturer Nissan since 1995.  For its early generations, the Almera is a compact car (C-segment), essentially being the European export-market version of the Pulsar for the first-generation model (N15), and the Bluebird Sylphy for the second-generation model (N16).  Since the third-generation model (N17), the Almera nameplate was repositioned to a subcompact or B-segment saloon based on the V platform."
North Jakarta,en,s,"North Jakarta (Indonesian: Jakarta Utara; Betawi: Jakarte Belilir), abbreviated as Jakut, is one of the five administrative cities (kota administrasi) which form Special Capital Region of Jakarta, Indonesia.  North Jakarta is not self-governed and does not have a city council, hence it is not classified as a proper municipality.  It contains the entire coastal area within the Jakarta Special Capital Region."
United States,en,s,"The United States of America (USA), commonly known as the United States (U. S. ) or America, is a country primarily located in North America.  It is a federal union of 50 states and a federal capital district, Washington, D. C.  The 48 contiguous states border Canada to the north and Mexico to the south, with the states of Alaska to the northwest and the archipelagic Hawaii in the Pacific Ocean."
fractional distillation,en,s,
hyperbole,en,s,"Hyperbole ( ; adj.  hyperbolic  ) is the use of exaggeration as a rhetorical device or figure of speech.  In rhetoric, it is also sometimes known as auxesis (literally 'growth').  In poetry and oratory, it emphasizes, evokes strong feelings, and creates strong impressions.  As a figure of speech, it is usually not meant to be taken literally.  Etymology 'Hyperbole' is derived from the Ancient Greek: ὑπερβολή huperbolḗ by way of Latin."
Soyuz TMA,en,s,"The Soyuz-TMA (Russian: транспортный модифицированный антропометрический, romanized: Transportnyi Modifitsirovannyi Antropometricheskii, lit.  'Transport Modified Anthropometric') was a spacecraft built by Energia and used by Roscosmos for human spaceflight.  It is a revision of the Soyuz spacecraft introduced in 2001 and was in use until 2012 after being superseded in 2010 by the Soyuz TMA-M."
hydrogen fuel,en,s,"The hydrogen economy is an umbrella term for the roles hydrogen can play alongside low-carbon electricity to reduce emissions of greenhouse gases.  The aim is to reduce emissions where cheaper and more energy-efficient clean solutions are not available.  In this context, hydrogen economy encompasses the production of hydrogen and the use of hydrogen in ways that contribute to phasing-out fossil fuels and limiting climate change. Hydrogen can be produced by several means."
Internal combustion engine,en,s,"An internal combustion engine (ICE or IC engine) is a heat engine in which the combustion of a fuel occurs with an oxidizer (usually air) in a combustion chamber that is an integral part of the working fluid flow circuit.  In an internal combustion engine, the expansion of the high-temperature and high-pressure gases produced by combustion applies direct force to some component of the engine."
Geo Prizm,en,s,"The Geo Prizm and Chevrolet Prizm were compact cars that were rebadged versions of the Toyota Sprinter, a vehicle that the Japanese automaker Toyota never directly sold in the North American market.  The Sprinter itself was derived from the Toyota Corolla.  The Prizm was marketed under the Geo nameplate until it was discontinued after the 1997 model year.  After that, the vehicle was marketed under the Chevrolet nameplate."
pedelec,en,s,"A Pedelec (from pedal electric cycle) or EPAC (electronically power assisted cycle), is a type of low-powered electric bicycle where the rider's pedalling is assisted by a small electric motor.  However, unlike some other types of e-bikes, pedelecs are classified as conventional bicycles in many countries by road authorities rather than as a type of electric moped."
Vehicle,en,s,"A vehicle (from Latin  vehiculum) is a machine designed for self-propulsion, usually to transport people, cargo, or both.  The term ""vehicle"" typically refers to land vehicles such as human-powered vehicles (e. g.  bicycles, tricycles, velomobiles), animal-powered transports (e. g.  horse-drawn carriages/wagons, ox carts, dog sleds), motor vehicles (e. g."
Flying Pigeon,en,s,"Flying Pigeon (simplified Chinese: 飞鸽; traditional Chinese: 飛鴿; pinyin: fēigē) is a Chinese publicly owned bicycle company based in Tianjin.  Since 1950, more than 500 million Flying Pigeon PA-02 bicycles have been made, and as of 2007, more than any other model of vehicle.   History In 1936, a Japanese businessman built the Changho Works factory in Tianjin, and started to make ""Anchor"" bicycles.  The brand name was changed to ""Victory"", and then renamed to ""Zhongzi""."
lubricating oil,en,s,"A lubricant (sometimes shortened to lube) is a substance that helps to reduce friction between surfaces in mutual contact, which ultimately reduces the heat generated when the surfaces move.  It may also have the function of transmitting forces, transporting foreign particles, or heating or cooling the surfaces.  The property of reducing friction is known as lubricity. In addition to industrial applications, lubricants are used for many other purposes."
Bicycle,en,s,"Social cycle theories are among the earliest social theories in sociology.  Unlike the theory of social evolutionism, which views the evolution of society and human history as progressing in some new, unique direction(s), sociological cycle theory argues that events and stages of society and history generally repeat themselves in cycles.  Such a theory does not necessarily imply that there cannot be any social progress."
motorized bicycle,en,s,"A motorized bicycle is a bicycle with an attached motor or engine  and transmission used either to power the vehicle unassisted, or to assist with pedalling.  Since it sometimes retains both pedals and a discrete connected drive for rider-powered propulsion, the motorized bicycle is in technical terms a true bicycle, albeit a power-assisted one."
Atmosphere of Earth,en,s,
Toyota,en,s,"Toyota Motor Corporation (Japanese: トヨタ自動車株式会社, Hepburn: Toyota Jidōsha kabushikigaisha, IPA: [toꜜjota], English: , commonly known as simply Toyota) is a Japanese multinational automotive manufacturer headquartered in Toyota City, Aichi, Japan.  It was founded by Kiichiro Toyoda and incorporated on August 28, 1937.  Toyota is the largest automobile manufacturer in the world, producing about 10 million vehicles per year."
Spanish language in California,en,s,"The Spanish language is the most commonly spoken language in California after the English language, spoken by 28. 18 percent (10,434,308) of the population (in 2021).  Californian Spanish (español californiano) is a set of varieties of Spanish spoken in California, including the historical variety known as Californio Spanish (español californio). Spanish was first introduced to California in 1542 and has since become deeply entwined with California's cultural landscape and history."
Languages of California,en,s,"California is the most populous US state, with an estimated population of 38. 9 million as of 2023.  It has people from a wide variety of ethnic, racial, national, and religious backgrounds.  Population California is the most populated sub-national entity in North America.  If it were an independent country, California would rank 38th in population in the world.  Until recently, it had a larger population than Canada."
Energy transformation,en,s,"Energy transformation, also known as energy conversion, is the process of changing energy from one form to another.  In physics, energy is a quantity that provides the capacity to perform work or moving (e. g.  lifting an object) or provides heat.  In addition to being converted, according to the law of conservation of energy, energy is transferable to a different location or object, but it cannot be created or destroyed."
Daihatsu Consorte,en,s,"The Daihatsu Consorte is a small sedan sold by the Japanese automaker Daihatsu from 1969 to 1977.  It was based on the Toyota Publica, and its name, meaning ""consort"" in Italian, reflected Daihatsu's newly established affiliation with Toyota while also continuing the theme started with the preceding Compagno (""companion"").  It replaced the Compagno as Daihatsu's passenger vehicle."
rhetorical device,en,s,"In rhetoric, a rhetorical device, persuasive device, or stylistic device is a technique that an author or speaker uses to convey to the listener or reader a meaning with the goal of persuading them towards considering a topic from a perspective, using language designed to encourage or provoke an emotional display of a given perspective or action.  They seek to make a position or argument more compelling than it would otherwise be.  Sonic devices Sonic devices depend on sound."
Energies (journal),en,s,"Energies is a biweekly peer-reviewed open-access scientific journal.  It was established in 2008 and is published by MDPI.  The editor-in-chief is Enrico Sciubba (Sapienza University of Rome).  The journal publishes original papers, review articles, technical notes, and letters to the editor.  It concentrates on scientific research, technology, engineering, and management in relation to the field of energy supply, conversion, dispatch, and final usage."
auxesis (rhetoric),en,s,"Auxesis (‹See Tfd›Greek: αὔξησις, aúxēsis) is the Greek word for ""growth"" or ""increase""."
compact car,en,s,"Compact car is a vehicle size class—predominantly used in North America—that sits between subcompact cars and mid-size cars.  ""Small family car"" is a British term and a part of the C-segment in the European car classification.  However, before the downsizing of the United States car industry in the 1970s and 1980s, larger vehicles with wheelbases up to 110 in (2. 79 m) were considered ""compact cars"" in the United States."
Toyota Corolla,en,s,"The Toyota Corolla (Japanese: トヨタ・カローラ, Hepburn: Toyota Karōra) is a series of compact cars (formerly subcompact) manufactured and marketed globally by the Japanese automaker Toyota Motor Corporation.  Introduced in 1966, the Corolla was the best-selling car worldwide by 1974 and has been one of the best-selling cars in the world since then.  In 1997, the Corolla became the best-selling nameplate in the world, surpassing the Volkswagen Beetle."
Toyota Sprinter,en,s,"The Toyota Sprinter (Japanese: トヨタ・スプリンター, Toyota Supurintā) is a compact car manufactured by Toyota as a variant of the Toyota Corolla.  Exclusively sold in the Japanese domestic market, the Sprinter was aimed to be sportier than its Corolla sibling and also using different sheet metal mostly on the C-pillar.  The Sprinter and various body styles were exclusive to Toyota Auto Store until 1977 when the Toyota Chaser took the top position."
automotive,en,s,"A car, or an automobile, is a motor vehicle with wheels.  Most definitions of cars state that they run primarily on roads, seat one to eight people, have four wheels, and mainly transport people over cargo.  There are around one billion cars in use worldwide.  The car is considered an important part of the developed economy."
flammable liquid,en,s,
Holden Nova,en,s,"The Holden Nova is a compact car which was manufactured by Toyota Australia as a badge engineered Toyota Corolla between August 1989 and 1996.  It was a result of the Button car plan which attempted to rationalise the Australian car manufacturing industry.  The Nova was sold and marketed under the Holden nameplate, and although referred to as the GM S platform, was nearly identical to the Corolla.  However it received minor stylistic changes."
Compact car,en,s,"Compact car is a vehicle size class—predominantly used in North America—that sits between subcompact cars and mid-size cars.  ""Small family car"" is a British term and a part of the C-segment in the European car classification.  However, before the downsizing of the United States car industry in the 1970s and 1980s, larger vehicles with wheelbases up to 110 in (2. 79 m) were considered ""compact cars"" in the United States."
internal combustion engine,en,s,"An internal combustion engine (ICE or IC engine) is a heat engine in which the combustion of a fuel occurs with an oxidizer (usually air) in a combustion chamber that is an integral part of the working fluid flow circuit.  In an internal combustion engine, the expansion of the high-temperature and high-pressure gases produced by combustion applies direct force to some component of the engine."
Bicycle frame,en,s,"A bicycle frame is the main component of a bicycle, onto which wheels and other components are fitted.  The modern and most common frame design for an upright bicycle is based on the safety bicycle, and consists of two triangles: a main triangle and a paired rear triangle.  This is known as the diamond frame.  Frames are required to be strong, stiff and light, which they do by combining different materials and shapes."
California English,en,s,"California English (or Californian English) collectively refers to varieties of American English native to California.  As California became one of the most ethnically diverse U. S.  states, English speakers from a wide variety of backgrounds began to pick up different linguistic elements from one another and also developed new ones; the result is both divergence and convergence within California English."
car,en,s,"The cat (Felis catus), also referred to as domestic cat or house cat, is a small domesticated carnivorous mammal.  It is the only domesticated species of the family Felidae.  Advances in archaeology and genetics have shown that the domestication of the cat occurred in the Near East around 7500 BC.  It is commonly kept as a pet and farm cat, but also ranges freely as a feral cat avoiding human contact."
fuel,en,s,"Kamerun  was an African colony of the German Empire from 1884 to 1920 in the region of today's Republic of Cameroon.  Kamerun also included northern parts of Gabon and the Congo with western parts of the Central African Republic, southwestern parts of Chad and far northeastern parts of Nigeria.  History = Years preceding colonization (1868–1883) =The first German trading post in the Duala area  on the Kamerun River delta was established in 1868 by the Hamburg trading company C.  Woermann."
North American English,en,s,"North American English is the most generalized variety of the English language as spoken in the United States and Canada.  Because of their related histories and cultures, plus the similarities between the pronunciations (accents), vocabulary, and grammar of American English and Canadian English, the two spoken varieties are often grouped together under a single category.  Canadians are generally tolerant of both British and American spellings, with British spellings of certain words (e. g."
spacecraft,en,s,"A spacecraft is a vehicle that is designed to fly and operate in outer space.  Spacecraft are used for a variety of purposes, including communications, Earth observation, meteorology, navigation, space colonization, planetary exploration, and transportation of humans and cargo.  All spacecraft except single-stage-to-orbit vehicles cannot get into space on their own, and require a launch vehicle (carrier rocket)."
light truck,en,s,
California Office of Legislative Counsel,en,s,"The California Office of Legislative Counsel (OLC) (referenced in statute by its original name, the Legislative Counsel Bureau) was founded in 1913 and is a nonpartisan public agency that drafts legislative proposals, prepares legal opinions, and provides other confidential legal services to the Legislature and certain other California agencies and offices.  The OLC also provides computer services, data networking, customer support, and related technology services to the Legislature."
kinetic energy,en,s,"In physics, the kinetic energy of an object is the form of energy that it possesses due to its motion. In classical mechanics, the kinetic energy of a non-rotating object of mass m traveling at a speed v is                                           1            2                          m                  v                      2                                {\textstyle {\frac {1}{2}}mv^{2}}  ."
Automotive industry,en,s,"The automotive industry comprises a wide range of companies and organizations involved in the design, development, manufacturing, marketing, selling, repairing, and modification of motor vehicles.  It is one of the world's largest industries by revenue (from 16% such as in France up to 40% to countries such as Slovakia). The word automotive comes from the Greek autos (self), and Latin motivus (of motion), referring to any form of self-powered vehicle."
Buoyancy,en,s,"Buoyancy (), or upthrust is a net upward force exerted by a fluid that opposes the weight of a partially or fully immersed object.  In a column of fluid, pressure increases with depth as a result of the weight of the overlying fluid.  Thus, the pressure at the bottom of a column of fluid is greater than at the top of the column.  Similarly, the pressure at the bottom of an object submerged in a fluid is greater than at the top of the object."
Applied Energy,en,s,"Applied Energy is a peer-reviewed academic journal covering research on energy engineering that was established in 1975.  The journal covers areas of energy conversion and conservation, the optimal use of energy resources, analysis and optimization of energy processes, mitigation of environmental pollutants, and sustainable energy systems.  The Editor-in-Chiefs are Jianzhong Wu and Zita Vale. According to the Journal Citation Reports, the journal has a 2021 impact factor of 11."
List of best-selling automobiles,en,s,"Since the introduction of the Benz Patent Motorwagen in 1886, some passenger cars and light trucks can claim to being the highest selling vehicles in the automobile markets. While references to verify the manufacturers' claims have been included, there is always the possibility of inaccuracy or hyperbole."
C-segment,en,s,
outer space,en,s,
California,en,s,"California is a state in the Western United States, lying on the American Pacific Coast.  It borders Oregon to the north, Nevada and Arizona to the east, and an international border with the Mexican state of Baja California to the south.  With nearly 39 million residents across an area of 163,696 square miles (423,970 km2), it is the most populous U. S.  state, the third-largest by area, and most populated subnational entity in North America."
Daihatsu Charmant,en,s,"The Daihatsu Charmant (Japanese: ダイハツ・シャルマン, Hepburn: Daihatsu Sharuman) is a subcompact car built by Daihatsu of Japan, based on the Toyota Corolla.  It was succeeded by the Daihatsu Applause two years after Charmant production ended.  The Charmant was heavily based on the E20 Toyota Corolla; model changes paralleled those of the Corolla.  All Charmants were fitted with Toyota inline-four engines, ranging from 1. 2 to 1. 6 litres.  The word charmant is French for ""charming."
Toyota Allex,en,s,"The Toyota Corolla (E120/E130) is the ninth generation of compact cars sold by Toyota under the Corolla nameplate.  In Japan, this series arrived to the market in August 2000; however, exports were typically not achieved until 2001 and 2002 depending on the market. The sedan and station wagon arrived first in August 2000, followed by the five-door hatchback in January 2001, and the Europe-only three-door hatchback in 2002."
Toyota Tazz,en,s,
Astra Daihatsu Motor,en,s,"PT Astra Daihatsu Motor (also called ADM) is an automobile manufacturing company based in Jakarta, Indonesia.  It is a joint venture company between Daihatsu, Astra International and Toyota Tsusho.  It is the largest car manufacturer in Indonesia by production output and installed capacity, and has been second best-selling car brand behind Toyota.  ADM also supplied most Toyota-branded models sold in Indonesia, which includes compact cars such as Avanza, Rush, Agya and Calya."
vehicle,en,s,"A vehicle (from Latin  vehiculum) is a machine designed for self-propulsion, usually to transport people, cargo, or both.  The term ""vehicle"" typically refers to land vehicles such as human-powered vehicles (e. g.  bicycles, tricycles, velomobiles), animal-powered transports (e. g.  horse-drawn carriages/wagons, ox carts, dog sleds), motor vehicles (e. g."
Nissan,en,s,"Nissan Motor Corporation (日産自動車株式会社, Nissan Jidōsha kabushiki gaisha) is a Japanese multinational automobile manufacturer headquartered in Yokohama, Kanagawa, Japan.  The company sells its vehicles under the Nissan and Infiniti brands, and formerly the Datsun brand, with in-house performance tuning products (including cars) under the Nismo and Autech brands.  The company traces back to the beginnings of the 20th century, with the Nissan zaibatsu, now called Nissan Group."
petrochemical,en,s,"Petrochemicals (sometimes abbreviated as petchems) are the chemical products obtained from petroleum by refining.  Some chemical compounds made from petroleum are also obtained from other fossil fuels, such as coal or natural gas, or renewable sources such as maize, palm fruit or sugar cane. The two most common petrochemical classes are olefins (including ethylene and propylene) and aromatics (including benzene, toluene and xylene isomers)."
Toyota Auris,en,s,
figure of speech,en,s,"A figure of speech or rhetorical figure is a word or phrase that intentionally deviates from straightforward language use or literal meaning to produce a rhetorical or intensified effect (emotionally, aesthetically, intellectually, etc. ).  In the distinction between literal and figurative language, figures of speech constitute the latter."
flight,en,s,"Light, visible light, or visible radiation is electromagnetic radiation that can be perceived by the human eye.  Visible light spans the visible spectrum and is usually defined as having wavelengths in the range of 400–700 nanometres (nm), corresponding to frequencies of 750–420 terahertz.  The visible band sits adjacent to the infrared (with longer wavelengths and lower frequencies) and the ultraviolet (with shorter wavelengths and higher frequencies), called collectively optical radiation."
spaceflight,en,s,"Spaceflight (or space flight) is an application of astronautics to fly objects, usually spacecraft, into or through outer space, either with or without humans on board.  Most spaceflight is uncrewed and conducted mainly with spacecraft such as satellites in orbit around Earth, but also includes space probes for flights beyond Earth orbit.  Such spaceflights operate either by telerobotic or autonomous control."
List of most-produced aircraft,en,s,"This is a list of the most-produced aircraft types whose numbers exceed or exceeded 5,000.  Any and all types of aircraft qualify, including airplanes, airships, balloons, gliders (sailplanes), helicopters, etc.  Most-produced aircraft Notes Unless noted, aircraft are piston-engined  monoplanes. Role is generally either the original designed role of the aircraft or the role dominated production, disregarding minor variants."
rhetoric,en,s,"Rhetoric () is the art of persuasion.  It is one of the three ancient arts of discourse (trivium) along with grammar and logic/dialectic.  As an academic discipline within the humanities, rhetoric aims to study the techniques that speakers or writers use to inform, persuade, and motivate their audiences.  Rhetoric also provides heuristics for understanding, discovering, and developing arguments for particular situations."
Nissan Sunny,en,s,"The Nissan Sunny (Japanese: 日産・サニー, Hepburn: Nissan Sanī) is an automobile built by the Japanese automaker Nissan from 1966 till 2004.  In the early 1980s, the brand changed from Datsun to Nissan in line with other models by the company.  Although production of the Sunny in Japan ended in 2004, the name remains in use in China and GCC countries for a rebadged version of the Nissan Almera."
International Space Station,en,s,"The International Space Station (ISS) is a large space station that was assembled and is maintained in low Earth orbit by a collaboration of five space agencies and their contractors: NASA (United States), Roscosmos (Russia), ESA (Europe), JAXA (Japan), and CSA (Canada).  The ISS is the largest space station ever built.  Its primary purpose is to perform microgravity and space environment experiments."
Gasoline,en,s,"Gasoline (North American English) or petrol (Commonwealth English) is a petrochemical product characterized as a transparent, yellowish, and flammable liquid normally used as a fuel for spark-ignited internal combustion engines.  When formulated as a fuel for engines, gasoline is chemically composed of organic compounds derived from the fractional distillation of petroleum and later chemically enhanced with gasoline additives."
Soyuz (spacecraft),en,s,"Soyuz (Russian: Союз, IPA: [sɐˈjus], lit.  'Union') is a series of spacecraft which has been in service since the 1960s, having made more than 140 flights.  It was designed for the Soviet space program by the Korolev Design Bureau (now Energia).  The Soyuz succeeded the Voskhod spacecraft and was originally built as part of the Soviet crewed lunar programs.  It is launched atop the similarly named Soyuz rocket from the Baikonur Cosmodrome in Kazakhstan."
