id,lang,shape,content
August Batsch,en,s,"August Johann Georg Karl Batsch (28 October 1761 – 29 September 1802) was a German naturalist.  He was a recognised authority on mushrooms, and also described new species of ferns, bryophytes, and seed plants.  Life and career Batsch was born in Jena, Saxe-Weimar to George Lorenz Bratsch and Ernestine (nee Franke) Bratsch.  He studied at the Jena City School, and then had private tuition."
Bonn,en,s,"Bon or Bön (Tibetan: བོན་, Wylie: bon, ZYPY: Pön, Lhasa dialect: [pʰø̃̀]), also known as Yungdrung Bon (Tibetan: གཡུང་དྲུང་བོན་, Wylie: gyung drung bon, ZYPY: Yungchung Pön, lit.  'eternal Bon'), is the indigenous Tibetan religion which shares many similarities and influences with Tibetan Buddhism.  It initially developed in the tenth and eleventh centuries but retains elements from earlier Tibetan religious traditions."
Constantine Samuel Rafinesque,en,s,"Constantine Samuel Rafinesque-Schmaltz (French pronunciation: [kɔ̃stɑ̃tin samɥɛl ʁafinɛsk(ə)ʃmalts]; 22 October 1783 – 18 September 1840) was a French early 19th-century polymath born near Constantinople in the Ottoman Empire and self-educated in France.  He traveled as a young man in the United States, ultimately settling in Ohio in 1815, where he made notable contributions to botany, zoology, and the study of prehistoric earthworks in North America."
cervical vertebrae,en,s,"In tetrapods, cervical vertebrae (sg. : vertebra) are the vertebrae of the neck, immediately below the skull.  Truncal vertebrae (divided into thoracic and lumbar vertebrae in mammals) lie caudal (toward the tail) of cervical vertebrae.  In sauropsid species, the cervical vertebrae bear cervical ribs.  In lizards and saurischian dinosaurs, the cervical ribs are large; in birds, they are small and completely fused to the vertebrae."
Guy's Hospital,en,s,"Guy's Hospital is an NHS hospital founded by Thomas Guy, located in the borough of Southwark in central London.  It is part of Guy's and St Thomas' NHS Foundation Trust and one of the institutions that comprise the King's Health Partners, an academic health science centre. It is a large teaching hospital and is, with St Thomas' Hospital and King's College Hospital, the location of King's College London GKT School of Medical Education."
Duchy of Saxe-Weimar,en,s,"Saxe-Weimar-Eisenach (German: Sachsen-Weimar-Eisenach) was a German state, created as a duchy in 1809 by the merger of the Ernestine duchies of Saxe-Weimar and Saxe-Eisenach, which had been in personal union since 1741.  It was raised to a grand duchy in 1815 by resolution of the Congress of Vienna.  In 1903, it officially changed its name to the Grand Duchy of Saxony (German: Großherzogtum Sachsen), but this name was rarely used."
Emydidae,en,s,"Emydidae (Latin emys (freshwater tortoise) + Ancient Greek εἶδος (eîdos, “appearance, resemblance”)) is a family of testudines (turtles) that includes close to 50 species in 10 genera.  Members of this family are commonly called terrapins, pond turtles, or marsh turtles.  Several species of Asian box turtles were formerly classified in the family; however, revised taxonomy has separated them to a different family (Geoemydidae)."
John Edward Gray,en,s,John Edward Gray  (12 February 1800 – 7 March 1875) was a British zoologist.  He was the elder brother of zoologist George Robert Gray and son of the pharmacologist and botanist Samuel Frederick Gray (1766–1828).  The standard author abbreviation J. E. Gray is used to indicate this person as the author when citing a botanical name.  The same is used for a zoological name.
Badnerlied,en,s,"The Badnerlied (""Song of the People of Baden"") is the unofficial hymn of the former state of Baden, now part of Baden-Württemberg.  Origin The song was adapted around 1865 from a similar hymn praising Saxony, which has since fallen into obscurity.   Two reference points are the Festung in Rastatt and the industrialization of Mannheim."
Dorset,en,s,"Dorset ( DOR-sit; archaically: Dorsetshire  DOR-sit-sheer, -⁠shər) is a ceremonial county in South West England.  It is bordered by Somerset to the north-west, Wiltshire to the north and the north-east, Hampshire to the east, the Isle of Wight across the Solent to the south-east, the English Channel to the south, and Devon to the west.  The largest settlement is Bournemouth, and the county town is Dorchester. The county has an area of 2,653 km2 (1,024 sq mi) and a population of 772,268."
zoological nomenclature,en,s,"The International Code of Zoological Nomenclature (ICZN) is a widely accepted convention in zoology that rules the formal scientific naming of organisms treated as animals.  It is also informally known as the ICZN Code, for its publisher, the International Commission on Zoological Nomenclature (which shares the acronym ""ICZN"")."
sedimentary rock,en,s,"Sedimentary rocks are types of rock that are formed by the accumulation or deposition of mineral or organic particles at Earth's surface, followed by cementation.  Sedimentation is the collective name for processes that cause these particles to settle in place.  The particles that form a sedimentary rock are called sediment, and may be composed of geological detritus (minerals) or biological detritus (organic matter)."
Late Jurassic,en,s,"The Late Jurassic is the third epoch of the Jurassic Period, and it spans the geologic time from 161. 5 ± 1. 0 to 145. 0 ± 0. 8 million years ago (Ma), which is preserved in Upper Jurassic strata. In European lithostratigraphy, the name ""Malm"" indicates rocks of Late Jurassic age.  In the past, Malm was also used to indicate the unit of geological time, but this usage is now discouraged to make a clear distinction between lithostratigraphic and geochronologic/chronostratigraphic units."
geologist,en,s,"A biologist is a scientist who conducts research in biology.  Biologists are interested in studying life on Earth, whether it is an individual cell, a multicellular organism, or a community of interacting populations.  They usually specialize in a particular branch (e. g. , molecular biology, zoology, and evolutionary biology) of biology and have a specific research focus (e. g. , studying malaria or cancer)."
Middle Triassic,en,s,"In the geologic timescale, the Middle Triassic is the second of three epochs of the Triassic period or the middle of three series in which the Triassic system is divided in chronostratigraphy.  The Middle Triassic spans the time between 247. 2 Ma and 237 Ma (million years ago).  It is preceded by the Early Triassic Epoch and followed by the Late Triassic Epoch.  The Middle Triassic is divided into the Anisian and Ladinian ages or stages."
Baden-Württemberg,en,s,
Das Lied der Deutschen,en,s,"The ""Deutschlandlied"", officially titled ""Das Lied der Deutschen"", is the national anthem of Germany.  It was first adopted in 1922 during the period of the Weimar Republic, replacing ""Heil dir im Siegerkranz"".  The first stanza of ""Deutchlandlied"" was used alongside the ""Horst-Wessel-Lied"" during the Nazi regime from 1933 until the end of World War II.  Since then, only the third stanza has been used officially as the national anthem."
genus,en,s,"Genre (French for 'kind, sort') is any style or form of communication in any mode (written, spoken, digital, artistic, etc. ) with socially agreed-upon conventions developed over time.  In popular usage, it normally describes a category of literature, music, or other forms of art or entertainment, based on some set of stylistic criteria.  Often, works fit into multiple genres by way of borrowing and recombining these conventions."
Hermann Schlegel,en,s,"Hermann Schlegel (10 June 1804 – 17 January 1884) was a German ornithologist, herpetologist and ichthyologist.  Early life and education Schlegel was born at Altenburg, the son of a brassfounder.  His father collected butterflies, which stimulated Schlegel's interest in natural history.  The discovery, by chance, of a buzzard's nest led him to the study of birds, and a meeting with Christian Ludwig Brehm. Schlegel started to work for his father, but soon tired of it."
Turtle Taxonomy Working Group,en,s,"The Turtle Taxonomy Working Group (TTWG) is an informal working group of the IUCN/SSC Tortoise and Freshwater Turtle Specialist Group (TFTSG).  It is composed of a number of leading turtle taxonomists, with varying participation by individual participants over the years, some dropping out and others joining."
International nongovernmental organization,en,s,"An international non-governmental organization (INGO) is an organization which is independent of government involvement and extends the concept of a non-governmental organization (NGO) to an international scope.  INGOs can admit members affiliated to government authorities as long as it does not interfere with their freedom to express themselves.  Around the world, there are about 75,000 international organizations and about 42,000 of them are active."
Alexander Roslin,en,s,
Upper Cretaceous,en,s,"The Late Cretaceous (100. 5–66 Ma) is the younger of two epochs into which the Cretaceous Period is divided in the geologic time scale.  Rock strata from this epoch form the Upper Cretaceous Series.  The Cretaceous is named after creta, the Latin word for the white limestone known as chalk.  The chalk of northern France and the white cliffs of south-eastern England date from the  Cretaceous Period."
Chelodina,en,s,"Chelodina, collectively known as snake-necked turtles, is a large and diverse genus of long-necked chelid turtles with a complicated nomenclatural history.  Although in the past, Macrochelodina and Macrodiremys have been considered separate genera and prior to that all the same, they are now considered subgenera of the Chelodina, further Macrochelodina and Macrodiremys are now known to apply to the same species, hence Chelydera is used for the northern snake-necked turtles."
organism,en,s,"Organicism is the philosophical position that states that the universe and its various parts (including human societies) ought to be considered alive and naturally ordered, much like a living organism.  Vital to the position is the idea that organicistic elements are not dormant ""things"" per se but rather dynamic components in a comprehensive system that is, as a whole, everchanging."
University of Pennsylvania,en,s,"The University of Pennsylvania (commonly known as Penn or UPenn) is a private Ivy League research university in Philadelphia, Pennsylvania, United States.  It is one of nine colonial colleges and was chartered prior to the U. S.  Declaration of Independence when Benjamin Franklin, the university's founder and first president, advocated for an educational institution that trained leaders in academia, commerce, and public service."
Black-knobbed map turtle,en,s,"The black-knobbed map turtle (Graptemys nigrinoda), formerly known as the black-knobbed sawback, is a small to medium-sized aquatic turtle with light gray skin.  Some of the most distinguishing characteristics of the black-knobbed map turtle, and the Graptemys genus, are the protruding ""spikes"" on the turtle's carapace.   This species inhabits mainly the fall lines of rivers in the Mobile Bay drainage, in Alabama and Mississippi.  Description The carapace of G."
Thomas Bell (zoologist),en,s,"Thomas Hornsey Bell FRS FLS (11 October 1792 – 13 March 1880) was an English zoologist, dental surgeon and writer, born in Poole, Dorset, England.  Career Bell, like his mother Susan, took a keen interest in natural history which his mother also encouraged in his younger cousin Philip Henry Gosse.  Bell left Poole in 1813 for his training as a dental surgeon in London."
United States Geological Survey,en,s,"The United States Geological Survey (USGS), founded as the Geological Survey, is an agency of the U. S.  Department of the Interior whose work spans the disciplines of biology, geography, geology, and hydrology.  The agency was founded on March 3, 1879, to study the landscape of the United States, its natural resources, and the natural hazards that threaten it.  The agency also makes maps of extraterrestrial planets and moons based on data from U. S.  space probes. The sole scientific agency of the U."
Selborne,en,s,"Seaborne Virgin Island Inc, operating as Seaborne Airlines, is a FAR Part 121 airline headquartered in Carolina, Puerto Rico, near the territory's capital of San Juan.  It operates a seaplane shuttle service between St.  Croix and St.  Thomas.  Originally headquartered on St.  Croix in the US Virgin Islands, the company relocated to Puerto Rico in 2014. Since April 2018, the airline has been owned by its parent company Silver Airways."
binomial nomenclature,en,s,"In taxonomy, binomial nomenclature (""two-term naming system""), also called binary nomenclature, is a formal system of naming species of living things by giving each a name composed of two parts, both of which use Latin grammatical forms, although they can be based on words from other languages.  Such a name is called a binomial name (which may be shortened to just ""binomial""), a binomen, binominal name, or a scientific name; more informally it is also historically called a Latin name."
suborder,en,s,"Order (Latin: ordo) is one of the eight major hierarchical taxonomic ranks in Linnaean taxonomy.  It is classified between family and  class.  In biological classification, the order is a taxonomic rank used in the classification of organisms and recognized by the nomenclature codes.  An immediately higher rank, superorder, is sometimes added directly above order, with suborder directly beneath order.  An order can also be defined as a group of related families."
Common box turtle,en,s,"The common box turtle (Terrapene carolina) is a species of box turtle with five existing subspecies.  It is found throughout the Eastern United States and Mexico.  The box turtle has a distinctive hinged lower shell that allows it to completely enclose itself, like a box.  Its upper jaw is hooked.  The turtle is primarily terrestrial and eats a wide variety of plants and animals.  The females lay their eggs in the summer.  Turtles in the northern part of their range hibernate over the winter."
Ammonite,en,s,"Ammonoids are extinct spiral shelled cephalopods comprising the subclass Ammonoidea.  They are more closely related to living coleoids (i. e. , octopuses, squid and cuttlefish) than they are to shelled nautiloids (such as the living Nautilus).  The earliest ammonoids appeared during the Devonian, with the last species vanishing during or soon after the Cretaceous–Paleogene extinction event."
Aldabra giant tortoise,en,s,"The Aldabra giant tortoise (Aldabrachelys gigantea) is a species of tortoise in the family Testudinidae and genus Aldabrachelys.  The species is endemic to the Seychelles, with the nominate subspecies, A.  g.  gigantea native to Aldabra atoll.  It is one of the largest tortoises in the world."
turtle,en,s,"Purple is a color similar in appearance to violet light.  In the RYB color model historically used in the arts, purple is a secondary color created by combining red and blue pigments.  In the CMYK color model used in modern printing, purple is made by combining magenta pigment with either cyan pigment, black pigment, or both.  In the RGB color model used in computer and television screens, purple is created by mixing red and blue light in order to create colors that appear similar to violet light."
William John Swainson,en,s,"William John Swainson FLS, FRS (8 October 1789 – 6 December 1855), was an English ornithologist, malacologist, conchologist, entomologist, and artist.  Life Swainson was born in Dover Place, St Mary Newington, London, the eldest son of John Timothy Swainson the Second (1756–1824), an original fellow of the Linnean Society.  He was cousin of the amateur botanist Isaac Swainson."
mating type,en,s,Mating types are the microorganism equivalent to sexes in multicellular lifeforms and are thought to be the ancestor to distinct sexes.  They also occur in multicellular organisms such as fungi.  Definition Mating types are the microorganism equivalent to sex in higher organisms and occur in isogamous species.
geology,en,s,"Geology (from Ancient Greek  γῆ (gê) 'earth' and  λoγία (-logía) 'study of, discourse') is a branch of natural science concerned with the Earth and other astronomical objects, the rocks of which they are composed, and the processes by which they change over time.  Modern geology significantly overlaps all other Earth sciences, including hydrology.  It is integrated with Earth system science and planetary science."
