id,lang,shape,content
Gabriel Bibron,en,s,"Gabriel Bibron (20 October 1805 – 27 March 1848) was a French zoologist and herpetologist.  He was born in Paris.  The son of an employee of the Museum national d'histoire naturelle, he had a good foundation in natural history and was hired to collect vertebrates in Italy and Sicily.  Under the direction of Jean Baptiste Bory de Saint-Vincent (1778–1846), he took part in the Morea expedition to Peloponnese."
Global Boundary Stratotype Section and Point,en,s,"A Global Boundary Stratotype Section and Point (GSSP), sometimes referred to as a golden spike, is an internationally agreed upon reference point on a stratigraphic section which defines the lower boundary of a stage on the geologic time scale.   The effort to define GSSPs is conducted by the International Commission on Stratigraphy, a part of the International Union of Geological Sciences.   Most, but not all, GSSPs are based on paleontological changes."
vertebra,en,s,"Each vertebra (pl. : vertebrae) is an irregular bone with a complex structure composed of bone and some hyaline cartilage, that make up the vertebral column or spine, of vertebrates.  The proportions of the vertebrae differ according to their spinal segment and the particular species. The basic configuration of a vertebra varies; the bone is the body, and the central part of the body is the centrum.  The upper and lower surfaces of the vertebra body give attachment to the intervertebral discs."
States of Germany,en,s,"The Federal Republic of Germany, as a federal state, consists of sixteen states.  Berlin, Hamburg and Bremen (with its seaport exclave, Bremerhaven) are called Stadtstaaten (""city-states""), while the other thirteen states are called Flächenländer (""area states"") and include Bavaria, Saxony, and Thuringia, which describe themselves as Freistaaten (""free states"")."
geologic time scale,en,s,The geologic time scale or geological time scale (GTS) is a representation of time based on the rock record of Earth.  It is a system of chronological dating that uses chronostratigraphy (the process of relating strata to time) and geochronology (a scientific branch of geology that aims to determine the age of rocks).
Johann Friedrich Gmelin,en,s,"Johann Friedrich Gmelin (8 August 1748 – 1 November 1804) was a German naturalist, chemist, botanist, entomologist, herpetologist, and malacologist.  Education Johann Friedrich Gmelin was born as the eldest son of Philipp Friedrich Gmelin in 1748 in Tübingen."
Landtag of Baden-Württemberg,en,s,"The Landtag of Baden-Württemberg is the diet of the German state of Baden-Württemberg.  It convenes in Stuttgart and currently consists of 154 members of five political parties.  The majority before the 2021 election was a coalition of the Alliance 90/The Greens and the Christian Democratic Union (CDU), supporting the cabinet of Green Minister-President Winfried Kretschmann."
King's College London,en,s,"King's College London (informally King's or KCL) is a public research university located in London, England.  King's was established by royal charter in 1829 under the patronage of King George IV and the Duke of Wellington.  In 1836, King's became one of the two founding colleges of the University of London.  It is one of the oldest university-level institutions in England."
Cryptodira,en,s,"The Cryptodira (Greek: hidden neck) are a suborder of Testudines that includes most living tortoises and turtles.  Cryptodira is commonly called the ""Hidden-Neck Turtles"" or the ""Inside-Neck Turtles"".  Cryptodira differ from Pleurodira (side-necked turtles) in that they lower their necks and pull the heads straight back into the shells, instead of folding their necks sideways along the body under the shells' marginals."
neck,en,s,"Nick is a masculine given name.  It is  also often encountered as a short form (hypocorism) of the given names Nicholas, Nicola,  Nicolas, Nikola, Nicolai or Nicodemus."
Amiens,en,s,
International Commission on Stratigraphy,en,s,"The International Commission on Stratigraphy (ICS), sometimes unofficially referred to as the ""International Stratigraphic Commission"", is a daughter or major subcommittee grade scientific daughter organization that concerns itself with stratigraphical, geological, and geochronological matters on a global scale.  It is the largest subordinate body of the International Union of Geological Sciences (IUGS)."
Species Plantarum,en,s,"Species Plantarum (Latin for ""The Species of Plants"") is a book by Carl Linnaeus, originally published in 1753, which lists every species of plant known at the time, classified into genera.  It is the first work to consistently apply binomial names and was the starting point for the naming of plants.  Publication Species Plantarum was published on 1 May 1753 by Laurentius Salvius in Stockholm, in two volumes."
Electorate of Brunswick-Lüneburg,en,s,"The Electorate of Hanover (German: Kurfürstentum Hannover or simply Kurhannover) was an electorate of the Holy Roman Empire located in northwestern Germany that arose from the Principality of Calenberg.  Although formally known as the Electorate of Brunswick-Lüneburg (German: Kurfürstentum Braunschweig-Lüneburg), it made Hanover its capital city.  For most of its existence, the electorate was ruled in personal union with Great Britain and Ireland following the Hanoverian Succession."
lithostratigraphy,en,s,"Lithostratigraphy is a sub-discipline of stratigraphy, the geological science associated with the study of strata or rock layers.  Major focuses include geochronology, comparative geology, and petrology. In general, strata are primarily igneous or sedimentary relating to how the rock was formed.  Sedimentary layers are laid down by deposition of sediment associated with weathering processes, decaying organic matter (biogenic) or through chemical precipitation."
Paleontology,en,s,"Paleontology ( PAY-lee-on-TOL-ə-jee, PAL-ee-, -⁠ən-), also spelled palaeontology or palæontology, is the scientific study of life that existed prior to the start of the Holocene epoch (roughly 11,700 years before present).  It includes the study of fossils to classify organisms and study their interactions with each other and their environments (their paleoecology).  Paleontological observations have been documented as far back as the 5th century BC."
Gregorian calendar,en,s,"The Gregorian calendar is the calendar used in most parts of the world.  It went into effect in October 1582 following the papal bull Inter gravissimas issued by Pope Gregory XIII, which introduced it as a modification of, and replacement for, the Julian calendar.  The principal change was to space leap years differently so as to make the average calendar year 365. 2425 days long, more closely approximating the 365."
fossil,en,s,"A fossil (from Classical Latin fossilis, lit.  'obtained by digging') is any preserved remains, impression, or trace of any once-living thing from a past geological age.  Examples include bones, shells, exoskeletons, stone imprints of animals or microbes, objects preserved in amber, hair, petrified wood and DNA remnants.  The totality of fossils is known as the fossil record."
Råshult,en,s,"Råshult is a village just north of Älmhult in Kronoberg County, Småland, Sweden.  It is notable as the birthplace of the seminal biologist and ""father of modern taxonomy"", Carl Linnaeus (1707–1778)."
Batsch,en,s,"The term punch refers to a wide assortment of drinks, both non-alcoholic and alcoholic, generally containing fruits or fruit juice.  The drink was introduced from the Indian subcontinent to England by employees of the East India Company in the late 17th century.  Punch is usually served at parties in large, wide bowls, known as punch bowls. In the United States, federal regulations provide the word ""punch"" to describe commercial beverage products that do not contain fruit or fruit juice."
International Union of Geological Sciences,en,s,"The International Union of Geological Sciences (IUGS) is an international non-governmental organization devoted to international cooperation in the field of geology.  As of 2023, it represents more than 1 million geoscientists around the world.  About The IUGS was founded in 1961 to ensure continued collaboration between the International Geological Congresses, which have taken place every four years since 1875."
Edward Drinker Cope,en,s,"Edward Drinker Cope (July 28, 1840 – April 12, 1897) was an American zoologist, paleontologist, comparative anatomist, herpetologist, and ichthyologist.  Born to a wealthy Quaker family, he distinguished himself as a child prodigy interested in science, publishing his first scientific paper at the age of 19.  Though his father tried to raise Cope as a gentleman farmer, he eventually acquiesced to his son's scientific aspirations."
Philipp Friedrich Gmelin,en,s,"Philipp Friedrich Gmelin (19 August 1721 – 9 May 1768) was a professor of botany and chemistry.  He studied the chemistry of antimony and wrote texts on the pancreatic ducts, mineral waters, and botany. He was a brother of the famous traveler Johann Georg Gmelin.  He obtained his Master's degree in 1742, at the University of Tübingen under Burchard Mauchart. He was elected a Fellow of the Royal Society in 1758. He was the father of the naturalist Johann Friedrich Gmelin."
Jena,en,s,"Jens is a male given name and a Danish, Dutch, German, Norwegian, Swedish, Icelandic, Faroese and Frisian derivative of Johannes.  It was the top given name for boys in Denmark in 2008."
nomen nudum,en,s,"In taxonomy, a nomen nudum ('naked name'; plural nomina nuda) is a designation which looks exactly like a scientific name of an organism, and may have originally been intended to be one, but it has not been published with an adequate description.  This makes it a ""bare"" or ""naked"" name, which cannot be accepted as it stands.  A largely equivalent but much less frequently used term is nomen tantum (""name only"")."
Paris,en,s,"Paris (French pronunciation: [paʁi] ) is the capital and largest city of France.  With an official estimated population of 2,102,650 residents in January 2023 in an area of more than 105 km2 (41 sq mi), Paris is the fourth-largest city in the European Union and the 30th most densely populated city in the world in 2022.  Since the 17th century, Paris has been one of the world's major centres of finance, diplomacy, commerce, culture, fashion, and gastronomy."
Swedish calendar,en,s,"The Swedish calendar (Swedish: svenska kalendern) or Swedish style (svenska stilen) was a calendar in use in Sweden and its possessions from 1 March 1700 until 30 February 1712.  It was one day ahead of the Julian calendar and ten days behind the Gregorian calendar.  Easter was calculated astronomically, with a minor exception, from 1740 to 1844."
subcommittee,en,s,"A committee or commission is a body of one or more persons subordinate to a deliberative assembly or other form of organization.  A committee may not itself be considered to be a form of assembly or a decision making body.  Usually, an assembly or organization sends matters to a committee as a way to explore them more fully than would be possible if the whole assembly or organization were considering them."
Stuttgart,en,s,"Stuttgart (German: [ˈʃtʊtɡaʁt] ; Swabian: Schduagert [ˈʒ̊d̥ua̯ɡ̊ɛʕd̥]; names in other languages) is the capital and largest city of the German state of Baden-Württemberg.  It is located on the Neckar river in a fertile valley known as the Stuttgarter Kessel (Stuttgart Cauldron) and lies an hour from the Swabian Jura and the Black Forest.  Stuttgart has a population of 632,865 as of 2022, making it the sixth largest city in Germany, while over 2."
Reproduction,en,s,"Reproduction (or procreation or breeding) is the biological process by which new individual organisms – ""offspring"" – are produced from their ""parent"" or parents.  There are two forms of reproduction: asexual and sexual. In asexual reproduction, an organism can reproduce without the involvement of another organism.  Asexual reproduction is not limited to single-celled organisms.  The cloning of an organism is a form of asexual reproduction."
Haverford College,en,s,"Haverford College ( HAV-ər-fərd) is a private liberal arts college in Haverford, Pennsylvania.  It was founded as a men's college in 1833 by members of the Religious Society of Friends (Quakers).  Haverford began accepting non-Quakers in 1849 and women in 1980. The college offers Bachelor of Arts and Bachelor of Science degrees in 31 majors across humanities, social sciences and natural sciences disciplines."
Carl Linnaeus,en,s,"Carl Linnaeus (23 May 1707 – 10 January 1778), also known after ennoblement in 1761 as Carl von Linné, was a Swedish biologist and physician who formalised binomial nomenclature, the modern system of naming organisms.  He is known as the ""father of modern taxonomy"".  Many of his writings were in Latin; his name is rendered in Latin as Carolus Linnæus and, after his 1761 ennoblement, as Carolus a Linné."
Kingdom of France,en,s,"The Kingdom of France is the historiographical name or umbrella term given to various political entities of France in the medieval and early modern period.  It was one of the most powerful states in Europe from the High Middle Ages to 1848 during its dissolution.  It was also an early colonial power, with colonies in Asia and Africa, and the largest being New France in North America centred around the Great Lakes."
First appearance datum,en,s,"First appearance datum (FAD) is a term used by geologists and paleontologists to designate the first appearance of a species in the geologic record.  FADs are determined by identifying the geologically oldest fossil discovered, to date, of a particular species.  A related term is last appearance datum (LAD), the last appearance of a species in the geologic record.  FADs are frequently used to designate segments in the geologic time scale."
André Marie Constant Duméril,en,s,"André Marie Constant Duméril (1 January 1774 – 14 August 1860) was a French zoologist.  He was professor of anatomy at the Muséum national d'histoire naturelle from 1801 to 1812, when he became professor of herpetology and ichthyology.  His son Auguste Duméril was also a zoologist, and the author citation Duméril is used for both André and his son.  Life André Marie Constant Duméril was born on 1 January 1774 in Amiens and died on 14 August 1860 in Paris."
10th edition of Systema Naturae,en,s,"The 10th edition of Systema Naturae (Latin; the English title is A General System of Nature) is a book written by Swedish naturalist Carl Linnaeus and published in two volumes in 1758 and 1759, which marks the starting point of zoological nomenclature.  In it, Linnaeus introduced binomial nomenclature for animals, something he had already done for plants in his 1753 publication of Species Plantarum."
rock strata,en,s,"In geology and related fields, a stratum (pl. : strata) is a layer of rock or sediment characterized by certain lithologic properties or attributes that distinguish it from adjacent layers from which it is separated by visible surfaces known as either bedding surfaces or bedding planes."
European Union,en,s,"The European Union (EU) is a supranational political and economic union of 27 member states that are located primarily in Europe.  The Union has a total area of 4,233,255 km2 (1,634,469 sq mi) and an estimated total population of over 449 million.  The EU has often been described as a sui generis political entity combining the characteristics of both a federation and a confederation. Containing 5."
species,en,s,"A species (pl. : species) is a population of organisms in which any two individuals of the appropriate sexes or mating types can produce fertile offspring, typically by sexual reproduction.  It is the basic unit of classification and a taxonomic rank of an organism, as well as a unit of biodiversity.  Other ways of defining species include their karyotype, DNA sequence, morphology, behaviour, or ecological niche."
stratigraphy,en,s,"Stratigraphy is a branch of geology concerned with the study of rock layers (strata) and layering (stratification).  It is primarily used in the study of sedimentary and layered volcanic rocks. Stratigraphy has three related subfields: lithostratigraphy (lithologic stratigraphy), biostratigraphy (biologic stratigraphy), and chronostratigraphy (stratigraphy by age)."
Pleurodira,en,s,"The Pleurodira are one of the two living suborders of turtles, the other being the Cryptodira.  The division between these two suborders represents a very deep evolutionary divide between two very different types of turtles.  The physical differences between them, although anatomical and largely internal, are nonetheless significant, and the zoogeographic implications of them are substantial."
Redcliff Point,en,s,"Redcliff Point is on the south coast of England, to the east of Weymouth in Dorset.  It lies just past the eastern end of the sweeping Weymouth Bay on the Jurassic Coast, a UNESCO World Heritage landscape known for its geology.  Fossils can be found in the Upper Oxford Clay in this area. The cliff looks over to the Isle of Portland.  It is so-called because of the red colouring of the cliffs at this point. Close by to the west are the Broadrock cliffs and Bowleaze Cove."
August Friedrich Schweigger,en,s,"August Friedrich Schweigger (8 September 1783 – 28 June 1821) was a German naturalist born in Erlangen.  He was the younger brother of scientist Johann Salomo Christoph Schweigger (1779-1857). He studied medicine, zoology and botany at Erlangen, and following graduation spent time in Berlin (from 1804) and Paris (from 1806).  In 1809 he was appointed professor of botany and medicine at the University of Königsberg."
Axis (anatomy),en,s,"In anatomy,  the axis (from Latin axis, ""axle"") is the second cervical vertebra (C2) of the spine, immediately inferior to the atlas, upon which the head rests.  The spinal cord passes through the axis. The defining feature of the axis is its strong bony protrusion known as the dens, which rises from the superior aspect of the bone.  Structure The body is deeper in front or in the back and is prolonged downward anteriorly to overlap the upper and front part of the third vertebra."
Eastern long-necked turtle,en,s,"The eastern long-necked turtle (Chelodina longicollis) is an east Australian species of snake-necked turtle that inhabits a wide variety of water bodies and is an opportunistic feeder.  It is a side-necked turtle (Pleurodira), meaning that it bends its head sideways into its shell rather than pulling it directly back."
tetrapod,en,s,"A tetrapod (; from Ancient Greek τετρα- (tetra-) 'four'  and πούς (poús) 'foot') is any four-limbed vertebrate animal of the superclass Tetrapoda ().  Tetrapods include all extant and extinct amphibians and amniotes, with the latter in turn evolving into two major clades, the sauropsids (reptiles, including dinosaurs and therefore birds) and synapsids (extinct pelycosaurs, therapsids and all extant mammals, including humans)."
sex,en,s,"Java Platform, Standard Edition (Java SE) is a computing platform for development and deployment of portable code for desktop and server environments.  Java SE was formerly known as Java 2 Platform, Standard Edition (J2SE). The platform uses the Java programming language and is part of the Java software-platform family."
animal,en,s,"Animals are multicellular, eukaryotic organisms in the biological kingdom Animalia ().  With few exceptions, animals consume organic material, breathe oxygen, have myocytes and are able to move, can reproduce sexually, and grow from a hollow sphere of cells, the blastula, during embryonic development.  Animals form a clade, meaning that they arose from a single common ancestor. Over 1. 5 million living animal species have been described, of which around 1."
Tübingen,en,s,"Tübingen (German: [ˈtyːbɪŋən] ; Swabian: Dibenga) is a traditional university city in central Baden-Württemberg, Germany.  It is situated 30 km (19 mi) south of the state capital, Stuttgart, and developed on both sides of the Neckar and Ammer rivers.  As of 2014 about one in three of the 90,000 people living in Tübingen is a student.  As of the 2018/2019 winter semester, 27,665 students attend the Eberhard Karl University of Tübingen."
Beauval Zoo,en,s,"The ZooParc de Beauval (French pronunciation: [zopaʁk də boval]), more commonly called Beauval Zoo or, more simply, Beauval, is a French zoological park located in Saint-Aignan-sur-Cher, Centre-Val de Loire.  It features more than 35,000 animals on 40 hectares, which is one of the largest animal collections in France and in Europe.  Created in 1980 by Françoise Delord, it is now run by her son, Rodolphe Delord, and managed by his family, which owns most of the capital."
Cardioceras,en,s,"Cardioceras is an extinct ammonite genus belonging to the family Cardioceratidae.  These fast-moving nektonic carnivores lived during the Jurassic period, Oxfordian age.  Description Shells of Cardioceras species can reach a diameter of 20–25 millimetres (0. 79–0. 98 in).  The shape is circular, with ribs and a prominent ridge along the dorsal edge.  Distribution Fossils of species within this genus have been found in the Jurassic of France, Germany, Poland, Russia, the United Kingdom and Alaska."
Germany,en,s,"Germany, officially the Federal Republic of Germany, is a country in Central Europe.  It lies between the Baltic and North Sea to the north and the Alps to the south.  Its sixteen constituent states have a total population of over 82 million in an area of 357,596 km2 (138,069 sq mi), making it the most populous member state of the European Union."
Julian calendar,en,s,"The Julian calendar is a solar calendar of 365 days in every year with an additional leap day every fourth year (without exception).  The Julian calendar is still used as a religious calendar in parts of the Eastern Orthodox Church and in parts of Oriental Orthodoxy as well as by the Amazigh people (also known as the Berbers).  The Julian calendar was proposed in 46 BC by (and takes its name from) Julius Caesar, as a reform of the earlier Roman calendar, which was largely a lunisolar one."
Göttingen,en,s,"Göttingen (, US also ; German: [ˈɡœtɪŋən] ; Low German: Chöttingen) is a university city in Lower Saxony, central Germany, the capital of the eponymous district.  The River Leine runs through it.  At the end of 2019, the population was 118,911.  Overview The origins of Göttingen lay in a village called Gutingi, first mentioned in a document in 953 AD.  The city was founded northwest of this village, between 1150 and 1200 AD, and adopted its name."
Poole,en,s,"A swimming pool, swimming bath, wading pool, paddling pool, or simply pool, is a structure designed to hold water to enable swimming or other leisure activities.  Pools can be built into the ground (in-ground pools) or built above ground (as a freestanding construction or as part of a building or other larger structure), and may be found as a feature aboard ocean-liners and cruise ships."
Muschelkalk,en,s,"The Muschelkalk (German for ""shell-bearing limestone""; French: calcaire coquillier) is a sequence of sedimentary rock strata (a lithostratigraphic unit) in the geology of central and western Europe.  It has a Middle Triassic (240 to 230 million years) age and forms the middle part of the three-part Germanic Trias (that gives the Triassic its name) lying above the older Buntsandstein and below the younger Keuper."
Bundespräsidialamt,en,s,"The Bundespräsidialamt (German: [ˌbʊndəspʁɛziˈdi̯aːlˌʔamt] ; ""Office of the Federal President"") is a federal agency (German: ""oberste Bundesbehörde"") of the Government of Germany assisting the President of Germany. The office building is situated beneath Bellevue Palace in Tiergarten in Berlin.  The seat was formerly in Bonn in the Villa Hammerschmidt and switched to Berlin with the Berlin-Bonn Act.  The agency moved into the actual building in 1998."
England,en,s,"England is a country that is part of the United Kingdom.  It is located on the island of Great Britain, of which it covers about 62%, and more than 100 smaller adjacent islands.  It has land borders with Scotland to the north and Wales to the west, and is otherwise surrounded by the North Sea to the east, the English Channel to the south, the Celtic Sea to the south-west, and the Irish Sea to the west.  Continental Europe lies to the south-east, and Ireland to the west."
Atlas (anatomy),en,s,"In anatomy, the atlas (C1) is the most superior (first) cervical vertebra of the spine and is located in the neck.  The bone is named for Atlas of Greek mythology, just as Atlas bore the weight of the heavens, the first cervical vertebra supports the head.  However, the term atlas was first used by the ancient Romans for the seventh cervical vertebra (C7) due to its suitability for supporting burdens."
Holy Roman Empire,en,s,"The Holy Roman Empire, also known as the Holy Roman Empire of the German Nation after 1512, was a polity in Central and Western Europe, usually headed by the Holy Roman Emperor.  It developed in the Early Middle Ages and lasted for almost a thousand years until its dissolution in 1806 during the Napoleonic Wars."
Berlin,en,s,"Berlin ( bur-LIN, German: [bɛʁˈliːn] ) is the capital and largest city of Germany, both by area and by population.  Its more than 3. 85 million inhabitants make it the European Union's most populous city, as measured by population within city limits.  The city is also one of the states of Germany, and is the third smallest state in the country in terms of area.  Berlin is surrounded by the state of Brandenburg, and Brandenburg's capital Potsdam is nearby."
